id,date,kwic,before,after
nla.obj-125586911,1880-06-05,y another of the children. A correspondent of the Aliens condemns the “Juve- nile Pinafore ” as simple cru,children|A|correspondent|of|the,condemns|the|Juve|nile|Pinafore
nla.obj-127626657,1880-11-06,"cause I believe these people to nists, and, being aliens in blood a class of people to introduce to thi FE",people|to|nists|and|being,in|blood|a|class|of
nla.obj-132948968,1881-05-07,"r than be reduced to misery by the competition of aliens, repugnant alike in person, in habits, and in sym",misery|by|the|competition|of,repugnant|alike|in|person|in
nla.obj-211155352,1882-05-20, A number of Circassian officers —mercenaries and aliens —were tried and convicted for participating in th,of|Circassian|officers|mercenaries|and,were|tried|and|convicted|for
nla.obj-211155352,1882-05-20,ity. But it is too deductive not to be seductive. Aliens. • m * Ezra Lazareck (Mr. J. L. Hall) and John La,deductive|not|to|be|seductive,m|Ezra|Lazareck|Mr|J
nla.obj-237271933,1882-07-08,"cely be reasonable to reckon upon mercenaries and aliens under such condi- tions, and it would not be surp",to|reckon|upon|mercenaries|and,under|such|condi|tions|and
nla.obj-237276574,1882-07-15,ence ito banishment. Ban- ishment of Circassians —aliens in Egypt—seemed little different from a farce. Th,banishment|Ban|ishment|of|Circassians,in|Egypt|seemed|little|different
nla.obj-237284283,1882-07-29,"and we don’t care about recognizing the claims of aliens. • * # ■Finally, the play was well put on, and ou",about|recognizing|the|claims|of,Finally|the|play|was|well
nla.obj-237284863,1882-08-12,"n by Um Benedicts of Cobar and the surrounding si aliens, last month. The position of M.C. was allotted to",Cobar|and|the|surrounding|si,last|month|The|position|of
nla.obj-237814884,1882-12-09,"t is. Feeble little Melbourne rag, Exile-writ for aliens. What a “ knocker ’’ you have got Showing ’mongst",Melbourne|rag|Exile|writ|for,What|a|knocker|you|have
nla.obj-237816958,1882-12-16,ning in it. Are there no cardinals shot dead by j aliens friars? Are all the nnes dead that have been invo,cardinals|shot|dead|by|j,friars|Are|all|the|nnes
nla.obj-238001130,1883-01-27,ousness about their slouch wmoh marks them out as aliens from the start And very ugly aliens they are. One,wmoh|marks|them|out|as,from|the|start|And|very
nla.obj-238001130,1883-01-27,s them out as aliens from the start And very ugly aliens they are. One of them comes out into the sunitgh',the|start|And|very|ugly,they|are|One|of|them
nla.obj-238156901,1883-03-24,"ish people. As these facts became recognised, the aliens- tiou between the proletariats in tho two countri",these|facts|became|recognised|the,tiou|between|the|proletariats|in
nla.obj-238171680,1883-04-21,ravel regularly between here and Victoria are the Aliens. And he was taken tor an Alien 1 Can ho now wonde,here|and|Victoria|are|the,And|he|was|taken|tor
nla.obj-243311026,1883-05-12," 3rd inst., when Mr. leaning, Mayor, made present aliens to the volunteers who rendered assistance, at som",Mr|leaning|Mayor|made|present,to|the|volunteers|who|rendered
nla.obj-238084712,1883-05-26,ed country will cease to be the plunder ground of aliens.” All the Peers in England are entitled to sit in,be|the|plunder|ground|of,All|the|Peers|in|England
nla.obj-238084712,1883-05-26,ted country wih cease to be the plunder ground of aliens.” All the Peers in England are entitled to sit in,be|the|plunder|ground|of,All|the|Peers|in|England
nla.obj-238211666,1883-07-28,"— Professor Denton accompanied Captain Armlt, the Aliens correspondent, to New Guinea. ... .Trlckett at Ki",Denton|accompanied|Captain|Armlt|the,correspondent|to|New|Guinea|Trlckett
nla.obj-238353546,1883-11-24, only possible because of the presence of so many aliens in the population.” 11 1 The band of the Permanen,the|presence|of|so|many,in|the|population|11|1
nla.obj-238323849,1883-12-08, and by night; to abolish trial by jury; to expel aliens; to re-establish the Norman curfew ; to suppress ,trial|by|jury|to|expel,to|re|establish|the|Norman
nla.obj-238327453,1883-12-15,iminals; marriage and divorce; naturalisation and aliens; fisheries; corporations and joint-stock companie,marriage|and|divorce|naturalisation|and,fisheries|corporations|and|joint|stock
nla.obj-239454416,1884-08-16,the better for getting rid of a lot of pam- pered aliens. A queer story is told in recently published memo,a|lot|of|pam|pered,A|queer|story|is|told
nla.obj-239454416,1884-08-16,"ll not find a native middle-class less cruel than aliens. At any rate, English workers have received no me",middle|class|less|cruel|than,At|any|rate|English|workers
nla.obj-239454416,1884-08-16,the better for getting rid of a lot of pam- pered aliens. A queer story is told in recently published memo,a|lot|of|pam|pered,A|queer|story|is|told
nla.obj-239454416,1884-08-16,"ll not find a native middle-class less cruel than aliens. At any rate, English workers have received no me",middle|class|less|cruel|than,At|any|rate|English|workers
nla.obj-239455897,1884-08-23," British Isles, and made the Saxon a ‘villein” to aliens, the native in- habitants held their lands in com",the|Saxon|a|villein|to,the|native|in|habitants|held
nla.obj-239455897,1884-08-23," British Isles, and made the Saxon a ‘villein” to aliens, the native in- habitants held their lands in com",the|Saxon|a|villein|to,the|native|in|habitants|held
nla.obj-239551862,1885-03-28,"ineligible. However, this is not the point. These aliens watch over each other’s back-slidings and lined a",is|not|the|point|These,watch|over|each|other|s
nla.obj-239706222,1885-09-05,icated. Men deficient in intellectual abandon are aliens in the realm of imagination. Still “ Convict Once,deficient|in|intellectual|abandon|are,in|the|realm|of|imagination
nla.obj-239730392,1885-10-31,"ith joy the decay of these institutions, a a much aliens to our free constitution as they are to our nativ",these|institutions|a|a|much,to|our|free|constitution|as
nla.obj-239759702,1885-11-21,"gin‘rate, with no appreciation of the humour of | aliens, fined him £2 and c ists, besides causing the loc",appreciation|of|the|humour|of,fined|him|2|and|c
nla.obj-239819665,1885-12-12,aland annually... During the last five years 3000 aliens have been naturalised in Queensland. Most of them,the|last|five|years|3000,have|been|naturalised|in|Queensland
nla.obj-507830809,1886-05-29, the other ? To trust the defence of a country to aliens and foreigners to the soil is not less foolish th,defence|of|a|country|to,and|foreigners|to|the|soil
nla.obj-507830809,1886-05-29, the other ? To trust the defence of a country to aliens and foreigners to the soil is not less foolish th,defence|of|a|country|to,and|foreigners|to|the|soil
nla.obj-513398234,1886-06-05,on gress has prohibited the labour of convicts or aliens on any Government work. And In South Australia Ch,the|labour|of|convicts|or,on|any|Government|work|And
nla.obj-513398234,1886-06-05,on gress has prohibited the labour of convicts or aliens on any Government work. And in South Australia Ch,the|labour|of|convicts|or,on|any|Government|work|And
nla.obj-507862378,1886-08-21,"ware of the mode of life which obtains With these aliens. But purcnasers of their and other wares are not,",life|which|obtains|With|these,But|purcnasers|of|their|and
nla.obj-507862378,1886-08-21,"ware of the mode of life which obtains With these aliens. But purchasers of their and other wares are not,",life|which|obtains|With|these,But|purchasers|of|their|and
nla.obj-507862411,1886-09-04,"nants for buildings near the Chinese quarter, the aliens were enabled to buy up more houses at a fraction ",near|the|Chinese|quarter|the,were|enabled|to|buy|up
nla.obj-507862411,1886-09-04,"e Chinese. Jurors seem to consider that, as these aliens act in systematic defiance of the law, they are n",to|consider|that|as|these,act|in|systematic|defiance|of
nla.obj-507862411,1886-09-04,"heir filth and crime, is that the labour of these aliens does tend to lower wages. The conclusion is clear",that|the|labour|of|these,does|tend|to|lower|wages
nla.obj-507862411,1886-09-04,"nants for buildings near the Chinese quarter, the aliens wore enabled to buy up more houses at a fraction ",near|the|Chinese|quarter|the,wore|enabled|to|buy|up
nla.obj-507862411,1886-09-04,"e Chinese. Jurors seem to consider that, as these aliens act in systematic defiance of the law, they are n",to|consider|that|as|these,act|in|systematic|defiance|of
nla.obj-507862411,1886-09-04,"heir filth and crime, is that the labour of these aliens does tend to lower wages. The conclusion is clear",that|the|labour|of|these,does|tend|to|lower|wages
nla.obj-507886214,1886-09-25,"uried with that epitaph, how swagmen without end, aliens and paupers from the time they set foot on these ",epitaph|how|swagmen|without|end,and|paupers|from|the|time
nla.obj-507886214,1886-09-25,blacks in that portion of the cemetery devoted to aliens and paupers.” No other place for him. Natural hei,of|the|cemetery|devoted|to,and|paupers|No|other|place
nla.obj-507886214,1886-09-25,"uried with that epitaph, how swagmen without end, aliens and paupers from the time they set foot on these ",epitaph|how|swagmen|without|end,and|paupers|from|the|time
nla.obj-507886214,1886-09-25,blacks in that portion of the cemetery devoted to aliens and paupers.” No other place for him. Natural hei,of|the|cemetery|devoted|to,and|paupers|No|other|place
nla.obj-507886393,1886-10-09,"t here as governors, their flunkeys, and bishops. Aliens in sentiment and habit, the governors make it the",governors|their|flunkeys|and|bishops,in|sentiment|and|habit|the
nla.obj-507886393,1886-10-09,"t here as governors, their flunkeys, and bishops. Aliens in sentiment and habit, the governors make it the",governors|their|flunkeys|and|bishops,in|sentiment|and|habit|the
nla.obj-507985892,1886-12-04,"se Restric- tion Act of 1882, the number of these aliens in the States has been decreasing at the rate of ",1882|the|number|of|these,in|the|States|has|been
nla.obj-507985892,1886-12-04,"ese Restric lion Act of 1882, the number of these aliens in the States has been decreasing at the rate of ",1882|the|number|of|these,in|the|States|has|been
nla.obj-507985934,1886-12-18," but their jaws ; What’s a country coming to when aliens g-rab the soil, And empty-headed blackguards make",a|country|coming|to|when,g|rab|the|soil|And
nla.obj-507985934,1886-12-18," but their jaws ; What’s a country coming to when aliens g-rab the soil, And empty-headed blackguards make",a|country|coming|to|when,g|rab|the|soil|And
nla.obj-692622883,1887-02-19,"re that all estates the property of non- resident aliens should be resumed by the State, .and that in futu",the|property|of|non|resident,should|be|resumed|by|the
nla.obj-693486521,1887-04-23," of that empire whereon the sun never sets, these aliens hold a position that the laws of New- South Wales",the|sun|never|sets|these,hold|a|position|that|the
nla.obj-693486521,1887-04-23, all events the absurd system by which the yellow aliens now- evade every restriction should at once be sw,system|by|which|the|yellow,now|evade|every|restriction|should
nla.obj-693499802,1887-05-21,"ing, worse than either the Tudors or the Stuarts. Aliens by birth, by speech, ana by sympathies, these pet",the|Tudors|or|the|Stuarts,by|birth|by|speech|ana
nla.obj-507985950,1887-07-16,on suf feriDg under the wretched misgovernment of aliens shall be allowed the same privileges of controlli,under|the|wretched|misgovernment|of,shall|be|allowed|the|same
nla.obj-507985950,1887-07-16,on suf fering under the wretched misgovernment of aliens shall be allowed the same privileges of controlli,under|the|wretched|misgovernment|of,shall|be|allowed|the|same
nla.obj-507985991,1887-07-30,"gal thrall And now can jubilate ; But Young Austi aliens, who’d forget the shame Which, erstwhile, darkene",can|jubilate|But|Young|Austi,who|d|forget|the|shame
nla.obj-507986032,1887-08-20,"upon the Imperialists of this colony as misguided aliens, whose traitorous designs upon our native liberty",of|this|colony|as|misguided,whose|traitorous|designs|upon|our
nla.obj-507986032,1887-08-20,"brother country. The coun- try which sent us such aliens to Australian thoughtas Bishop Barry, Tankerville",try|which|sent|us|such,to|Australian|thoughtas|Bishop|Barry
nla.obj-507986032,1887-08-20,e interfere on behalf of the brethren of W.ung Ho—aliens to our own people in habit and custom as they are,brethren|of|W|ung|Ho,to|our|own|people|in
nla.obj-507986032,1887-08-20,"to our own people in habit and custom as they are aliens to decency, to honesty, and to all municipal law.",and|custom|as|they|are,to|decency|to|honesty|and
nla.obj-507986032,1887-08-20,"upon the Imperialists of this colony as misguided aliens, whose traitorous designs upon our native liberty",of|this|colony|as|misguided,whose|traitorous|designs|upon|our
nla.obj-507986032,1887-08-20,"brother country. The coun- try which sent us such aliens to Australian thoughtas Bishop Barry, Tankbrville",try|which|sent|us|such,to|Australian|thoughtas|Bishop|Barry
nla.obj-507986032,1887-08-20,re interfere on behalf of the brethren of Wung Ho—aliens to our own people in habit and custom as they are,the|brethren|of|Wung|Ho,to|our|own|people|in
nla.obj-507986032,1887-08-20,"to our own people in habit and custom as they are aliens to decency, to honesty, and to all municipal law.",and|custom|as|they|are,to|decency|to|honesty|and
nla.obj-507986078,1887-09-24,try has become an American citizen simply because aliens cannot hold real estate in the United States. * *,an|American|citizen|simply|because,cannot|hold|real|estate|in
nla.obj-507986078,1887-09-24,try has become an American citizen simply because aliens cannot hold real estate in the United States. * *,an|American|citizen|simply|because,cannot|hold|real|estate|in
nla.obj-507994469,1887-10-08,ng then to prevent these spiritless and de- based aliens from putting in an extra hour every other day of ,these|spiritless|and|de|based,from|putting|in|an|extra
nla.obj-507994469,1887-10-08,ng then to prevent these spiritless and de- based aliens from putting in an extra hour every other day of ,these|spiritless|and|de|based,from|putting|in|an|extra
nla.obj-513697876,1887-10-29,"ed In- dians, Caffres, Zulus, Chinamen, and other aliens, who know no more of English than they do of anci",Caffres|Zulus|Chinamen|and|other,who|know|no|more|of
nla.obj-513697876,1887-10-29,"ed In- dians, Caffres, Zulus, Chinamen, and other aliens, who know no more of English than they do of anci",Caffres|Zulus|Chinamen|and|other,who|know|no|more|of
nla.obj-507994614,1887-11-12,"he dark, dismal and disgraceful past. But all are aliens to a national senti- ment which is rapidly growin",disgraceful|past|But|all|are,to|a|national|senti|ment
nla.obj-507994614,1887-11-12,"he dark, dismal and disgraceful past. But all are aliens to a national senti- ment which is rapidly growin",disgraceful|past|But|all|are,to|a|national|senti|ment
nla.obj-508016717,1888-02-04,"lence and the disease which fellows these unclean aliens like a shadow wherever they tread, a London paper",disease|which|fellows|these|unclean,like|a|shadow|wherever|they
nla.obj-508016717,1888-02-04,"lence and the disease which fellows these unclean aliens like a shadow wherever they tread, a London paper",disease|which|fellows|these|unclean,like|a|shadow|wherever|they
nla.obj-508016869,1888-03-03,"i 3, more or less, educating thousands of leprous aliens every year in her arts and industries, and in a f",less|educating|thousands|of|leprous,every|year|in|her|arts
nla.obj-508016869,1888-03-03,", Parkhs’ dia- tribes against the presence of the aliens are a hol- low mockery, as devoid of all substanc",against|the|presence|of|the,are|a|hol|low|mockery
nla.obj-508016869,1888-03-03," is, more or less, educating thousands of leprous aliens every year in her arts and industries, and in a f",less|educating|thousands|of|leprous,every|year|in|her|arts
nla.obj-508016869,1888-03-03," Parks s’ dia- tribes against the presence of the aliens are a hol- low mockery, as devoid of all substanc",against|the|presence|of|the,are|a|hol|low|mockery
nla.obj-513715084,1888-03-10,; the whole land is yellow with the procession of aliens who are swarming to take possession of the ruby-m,yellow|with|the|procession|of,who|are|swarming|to|take
nla.obj-513715084,1888-03-10,; the whole land is yellow with the procession of aliens who are swarming to take possession of the ruby-m,yellow|with|the|procession|of,who|are|swarming|to|take
nla.obj-508016928,1888-03-17,his friends wete the natuial allies of the yellow aliens whose very existence in the country is based on t,natuial|allies|of|the|yellow,whose|very|existence|in|the
nla.obj-508016928,1888-03-17,his friends weie the natural allies of the yellow aliens whose very existence in the country is based on t,natural|allies|of|the|yellow,whose|very|existence|in|the
nla.obj-539834388,1888-03-24, as their labour-sweated tenants instead of being aliens. The rank-and-file of the Irish movement deify Ar,sweated|tenants|instead|of|being,The|rank|and|file|of
nla.obj-539834388,1888-03-24, as their labour-sweated tenants instead of being aliens. The rank-and-file of the Irish movement deify Ar,sweated|tenants|instead|of|being,The|rank|and|file|of
nla.obj-706788911,1888-04-14,that there should be hornog e * p e J munity—that aliens should » rr itory■ overrun or even to inhabit our,p|e|J|munity|that,should|rr|itory|overrun|or
nla.obj-706788911,1888-04-14,"y to the limits of loathsomeness, and until these aliens are forced to live so that sufficient space is pe",of|loathsomeness|and|until|these,are|forced|to|live|so
nla.obj-706788911,1888-04-14,"of “blacklegs” is all that can be credited to the aliens. Hour for hour, no one of them is fit to work in ",can|be|credited|to|the,Hour|for|hour|no|one
nla.obj-508078009,1888-06-16," occasion the Premier has grudgingly released the aliens to whom the mandate directly applied, but has utt",Premier|has|grudgingly|released|the,to|whom|the|mandate|directly
nla.obj-508078009,1888-06-16," occasion the Premier has grudgingly released the aliens to whom the mandate directly applied, but has utt",Premier|has|grudgingly|released|the,to|whom|the|mandate|directly
nla.obj-508078051,1888-07-14," ; Confusion to the yellow face, Damnation to all aliens !” Don’t you consider, say, the French and German",yellow|face|Damnation|to|all,Don|t|you|consider|say
nla.obj-508078051,1888-07-14," ; Confusion to the yellow face, Damnation to all aliens !” Don’t you consider, say, the French and German",yellow|face|Damnation|to|all,Don|t|you|consider|say
nla.obj-508078115,1888-08-11,"e to British authors, as it proposes to extend to aliens the privileges hitherto reserved for American wri",it|proposes|to|extend|to,the|privileges|hitherto|reserved|for
nla.obj-508078115,1888-08-11,"e to British authors, as it proposes to extend to aliens the privileges hitherto reserved for American wri",it|proposes|to|extend|to,the|privileges|hitherto|reserved|for
nla.obj-508078211,1888-09-01," wa3 k? the law which prohibits the preferment of aliens,” longs_ for the growth of the same spirit in Aus",which|prohibits|the|preferment|of,longs_|for|the|growth|of
nla.obj-508078211,1888-09-01,"as i to the law which prohibits the preferment of aliens,” longs_ for the growth of the same spirit in Aus",which|prohibits|the|preferment|of,longs_|for|the|growth|of
nla.obj-706851190,1888-10-06,"ask — Whether the prerogative of right to exclude aliens ever existed in England, and whether, if it ever ",prerogative|of|right|to|exclude,ever|existed|in|England|and
nla.obj-508118130,1888-11-10, May a picker be or chooser. Tell of how artistic aliens (Thereby meaning choice It-a-lians) At the Opera ,chooser|Tell|of|how|artistic,Thereby|meaning|choice|It|a
nla.obj-508118130,1888-11-10, May a picker be or chooser. Tell of how artistic aliens (Thereby meaning choice It-a-lians) At the Opera ,chooser|Tell|of|how|artistic,Thereby|meaning|choice|It|a
nla.obj-508118196,1888-12-01,"at Australian Re- public is proclaimed, lords and aliens will have no place in her councils, will not be r",public|is|proclaimed|lords|and,will|have|no|place|in
nla.obj-508118196,1888-12-01,"at Australian Re- public is proclaimed, lords and aliens will have no place in her councils, will not be r",public|is|proclaimed|lords|and,will|have|no|place|in
nla.obj-488916974,1889-01-26,"reign- trader Fulsfobd replies, “Because they are aliens, a race whose habits are repugnant to our ideas.”",Fulsfobd|replies|Because|they|are,a|race|whose|habits|are
nla.obj-488916974,1889-01-26,"that we do not exclude the Chows because they are aliens ; if that were the reason, Germans, French, Itali",the|Chows|because|they|are,if|that|were|the|reason
nla.obj-488916974,1889-01-26,"oreign- trader Fulsfobd replies, “BecMue they are aliens, a race whose habits are repugnant to our ideas.”",Fulsfobd|replies|BecMue|they|are,a|race|whose|habits|are
nla.obj-488916974,1889-01-26,"that we do not exclude the Chows because they are aliens ; if that were the reason, Germans, French, Itali",the|Chows|because|they|are,if|that|were|the|reason
nla.obj-442506432,1889-04-27," race and our own creed, and because they are not aliens and lepers, and because they are close at hand in",and|because|they|are|not,and|lepers|and|because|they
nla.obj-442640978,1889-06-15,"an Arcadia. But we have the evidence of observant aliens to the effect that society, instead of being soft",have|the|evidence|of|observant,to|the|effect|that|society
nla.obj-442754483,1889-09-07,"itish constitution, and yet in denying to Chinese aliens their legal rights under the flag, was prepared t",yet|in|denying|to|Chinese,their|legal|rights|under|the
nla.obj-443468118,1889-09-28,hese disgusting squabbles imported by men who are aliens to our national thought? Why should the battles o,imported|by|men|who|are,to|our|national|thought|Why
nla.obj-443468152,1889-10-12,"s of Italians Greeks Poles, Hungarians, and other aliens’ herded together in the most unsavoury quarters’ ",Greeks|Poles|Hungarians|and|other,herded|together|in|the|most
nla.obj-448191008,1890-09-27," he can get and wants more, these two inexpensive aliens were at once recognised as essential parts of the",wants|more|these|two|inexpensive,were|at|once|recognised|as
nla.obj-488976523,1891-01-17,"red out to starvation, to make way for a horde of aliens. It is a sentence of death by starvation which Mr",way|for|a|horde|of,It|is|a|sentence|of
nla.obj-448663647,1891-05-30,"m all remittances are payable. Editorial commum c aliens to be addressed to J. F, Archibald.   Medical. NE",are|payable|Editorial|commum|c,to|be|addressed|to|J
nla.obj-449610341,1891-08-15,".P. (N.S.W.), wants to make the naturalisation of aliens more difficult of obtainal, by grafting on to the",to|make|the|naturalisation|of,more|difficult|of|obtainal|by
nla.obj-449854103,1891-12-05,Sheldon’s Bill prohibiting the indenting of cheap aliens to swamp the labour-market ot the province. The o,prohibiting|the|indenting|of|cheap,to|swamp|the|labour|market
nla.obj-449854103,1891-12-05,ur-market ot the province. The objection to these aliens is that they reduce wages and increase competitio,province|The|objection|to|these,is|that|they|reduce|wages
nla.obj-449854433,1892-01-09," alive, and a ship loaded down with more degraded aliens Nos. 50 to 100 is always on the way, to fill the ",loaded|down|with|more|degraded,Nos|50|to|100|is
nla.obj-450013488,1892-05-21,"bour by other people, whether they be citizens or aliens. This, then, being the case, it is difficult to s",whether|they|be|citizens|or,This|then|being|the|case
nla.obj-450013651,1892-06-11,"maginary, which can only be met by the service of aliens who cannot be admitted to our franchises, who are",met|by|the|service|of,who|cannot|be|admitted|to
nla.obj-450013651,1892-06-11,"apital, which even now reserves its wage fund for aliens. England expended the gigantic suin of twenty mil",reserves|its|wage|fund|for,England|expended|the|gigantic|suin
nla.obj-489032253,1892-07-02,"uralised in South Australia, and that both became aliens directly they crossed the border of any of the ot",Australia|and|that|both|became,directly|they|crossed|the|border
nla.obj-489039268,1892-07-30, the exclusion from the Queensland slave trade of aliens who have_ only been naturalised under Australian ,the|Queensland|slave|trade|of,who|have_|only|been|naturalised
nla.obj-489047526,1892-08-20,"y day in the week, ain't it 1 Twenty-six thousand aliens, mostly Russian and Polish, swarmed into England ",it|1|Twenty|six|thousand,mostly|Russian|and|Polish|swarmed
nla.obj-490751147,1892-09-17,"’s box was well filled, principally by'ice- regal aliens and strangers, for Lord Jersey wasn’t there: he w",filled|principally|by|ice|regal,and|strangers|for|Lord|Jersey
nla.obj-490751224,1892-10-15,"; ” none but gaoled criminals, paupers, lunatics, aliens and women will be disqualified from voting ; all ",but|gaoled|criminals|paupers|lunatics,and|women|will|be|disqualified
nla.obj-490907758,1892-12-24," the Act regulating the intro- duction of servile aliens, coloured labourers are being imported wholesale ",the|intro|duction|of|servile,coloured|labourers|are|being|imported
nla.obj-490907758,1892-12-24,ng that a license might be refused to all servile aliens. Yet we are gravely told in Parliament and the pr,be|refused|to|all|servile,Yet|we|are|gravely|told
nla.obj-490964785,1893-02-25,y British troops as of yore ; no power to exclude aliens ; and no authority to impose or remove Customs du,yore|no|power|to|exclude,and|no|authority|to|impose
nla.obj-490965144,1893-04-01,ople of the colonics would yet have to meet these aliens on a different ground to that on which they now s,yet|have|to|meet|these,on|a|different|ground|to
