id,date,kwic,before,after
nla.obj-600743215,1931-04-01,"alifica- tion) and, among others, peers, infants, aliens, bankrupts, lunatics and idiots. (1) What is the ",and|among|others|peers|infants,bankrupts|lunatics|and|idiots|1
nla.obj-600831429,1931-04-29, but in view of the present economic position all aliens proposing to come here for the purpose of taking ,the|present|economic|position|all,proposing|to|come|here|for
nla.obj-600831441,1931-05-06," sharp and devastating comments, edged with humor—aliens, con- spiring with each other for protection in t",devastating|comments|edged|with|humor,con|spiring|with|each|other
nla.obj-600835261,1931-07-01,"igures not available here. Write Chief Inspector, Aliens Branch, Home Office, Whitehall, London, S. A.J.M.",available|here|Write|Chief|Inspector,Branch|Home|Office|Whitehall|London
nla.obj-600905153,1931-08-26," enabling the deportation not only of undesirable aliens but, under certain circumstances, of native-born.",deportation|not|only|of|undesirable,but|under|certain|circumstances|of
nla.obj-600905190,1931-09-09,"g the status of any person under laws relating to aliens, marriage, divorce or bankruptcy, provided that a",person|under|laws|relating|to,marriage|divorce|or|bankruptcy|provided
nla.obj-600943415,1931-10-14,"and “How’s things?” and “Good-o,” but they remain aliens at heart. And they are amongst the world’s worst ",Good|o|but|they|remain,at|heart|And|they|are
nla.obj-603905256,1931-12-09," own creation. Her obscure references to royalty, aliens and medical practice _so alarm Mr. Bodie that he ",Her|obscure|references|to|royalty,and|medical|practice|_so|alarm
nla.obj-603999914,1932-04-13,"ee and sugar-cane are the principal products. (3) Aliens cannot purchase land, but can lease it for five y",are|the|principal|products|3,cannot|purchase|land|but|can
nla.obj-604000010,1932-05-18,"s (as if any country would be crazy enough to let aliens control its national bank!), and that the governo",be|crazy|enough|to|let,control|its|national|bank|and
nla.obj-604149368,1932-08-17,s that most of the demonstrators are Presbyterian aliens from Scotland and the north of Ireland. Mr. Kensi,of|the|demonstrators|are|Presbyterian,from|Scotland|and|the|north
nla.obj-604537951,1932-08-31,"birds —the birds ! victoria. IRENE WILKINSON. The Aliens. Once, once a£ I woke from slumber Or thought, it",birds|victoria|IRENE|WILKINSON|The,Once|once|a|I|woke
nla.obj-604935312,1932-12-07,t Indians like us better than they like any other aliens; they have never been able to hate us as the outs,than|they|like|any|other,they|have|never|been|able
nla.obj-604935336,1932-12-14,arded as grave offences and drastically punished. Aliens who practise these parts of the gospel according ,grave|offences|and|drastically|punished,who|practise|these|parts|of
nla.obj-604988603,1933-01-25,"les” will lose the vote and rank as unnaturalised aliens. Should they decide to return, and need the servi",vote|and|rank|as|unnaturalised,Should|they|decide|to|return
nla.obj-604988980,1933-03-01,Free State becoming a Republic? Would they become aliens here? —4306. It would not affect the status of pe,a|Republic|Would|they|become,here|4306|It|would|not
nla.obj-605007469,1933-03-29,rrested and charged with crime. British and other aliens are charged with offences every day of the week i,with|crime|British|and|other,are|charged|with|offences|every
nla.obj-605007469,1933-03-29,"ition there. He averred that survey operations by aliens were being car- ried out, that there were repeate",averred|that|survey|operations|by,were|being|car|ried|out
nla.obj-606964467,1933-04-05,"ds, who are mainly Assyrians, Armenians and other aliens, under a new by-law; but again the prosecution br",mainly|Assyrians|Armenians|and|other,under|a|new|by|law
nla.obj-606964467,1933-04-05,nd where could I get necessary papers? —4B96. All aliens who wish to settle here ar<- liable to be rcstr-i,get|necessary|papers|4B96|All,who|wish|to|settle|here
nla.obj-606971208,1933-04-19,and who are these Englishmen any- way practically aliens all of them not that there aren’t some decent spe,these|Englishmen|any|way|practically,all|of|them|not|that
nla.obj-607026156,1933-05-10,were being overhauled for further traces of these aliens. It was quite a young constable who suggested tha,for|further|traces|of|these,It|was|quite|a|young
nla.obj-607026428,1933-05-31,"ow-countrymen, or equal citizens, or anything but aliens in their native Ger- many! It is. this negation o",equal|citizens|or|anything|but,in|their|native|Ger|many
nla.obj-607320296,1934-02-07,", when it takes the form of unprovoked attacks on aliens, may involve a country in war with a foreign Powe",form|of|unprovoked|attacks|on,may|involve|a|country|in
nla.obj-607320338,1934-02-21, Malay is steadily being swamped under a flood of aliens will raise the racial issue in an acuter form tha,swamped|under|a|flood|of,will|raise|the|racial|issue
nla.obj-611034221,1934-07-18,e neighborhood of Broome —by the com- petition of aliens without Australian licenses and with no Australia,by|the|com|petition|of,without|Australian|licenses|and|with
nla.obj-612552940,1934-07-25,"n a holiday trip. An immigrant was defined in the Aliens Act, counsel pointed out, as “an alien steerage p",immigrant|was|defined|in|the,Act|counsel|pointed|out|as
nla.obj-611187890,1934-08-08, Bay). But nothing has hap- pened which will stop aliens who inter- fere with women in Arnhem Land from be,hap|pened|which|will|stop,who|inter|fere|with|women
nla.obj-611187890,1934-08-08,"rnhem Land from being wiped out, along with other aliens who may be innocent. Unless strangers are warned ",wiped|out|along|with|other,who|may|be|innocent|Unless
nla.obj-611243514,1934-11-07,he year mentioned the final repatriation of these aliens took place. “White-Austra- lian” sugar has been p,the|final|repatriation|of|these,took|place|White|Austra|lian
nla.obj-557902077,1935-02-13,t is here to stay. — A. U. S. (N.S.W.). Abos. and Aliens The Australian abo. is a long time com- ing into ,N|S|W|Abos|and,The|Australian|abo|is|a
nla.obj-557902154,1935-03-06,"thority. Still, if the power to shut out unwanted aliens is lacking it can be got; the Constitution, defec",power|to|shut|out|unwanted,is|lacking|it|can|be
nla.obj-557902179,1935-03-13,eme and unchallengeable power to reject and expel aliens. Federations are handicapped in these matters. Th,power|to|reject|and|expel,Federations|are|handicapped|in|these
nla.obj-553434833,1935-08-28,"lds. With Victoria trying to prevent an inrush of aliens, and Hong Kong send- ing us shiploads of Celestia",to|prevent|an|inrush|of,and|Hong|Kong|send|ing
nla.obj-553650240,1935-10-09," that he who “gives himself to be a possession of aliens leads a Yahoo life, having bartered his soul to a",to|be|a|possession|of,leads|a|Yahoo|life|having
nla.obj-553665283,1935-10-30,ts where the best specimens of these acclimatised aliens flourish. The Poynters motored back to Sydney. Lo,best|specimens|of|these|acclimatised,flourish|The|Poynters|motored|back
nla.obj-553665561,1935-11-06, that ne’er abates To letting any sort of colored aliens Encroach on our preserves or crash our gates. But,letting|any|sort|of|colored,Encroach|on|our|preserves|or
nla.obj-562701626,1936-01-08,", is that it is leading to a round-up of criminal aliens, beginning with those who have entered the U.S.A.",a|round|up|of|criminal,beginning|with|those|who|have
nla.obj-562701626,1936-01-08,thout its launches ; and now there are reports of aliens landing on Bathurst Island and near Cape Flattery,now|there|are|reports|of,landing|on|Bathurst|Island|and
nla.obj-573442376,1936-01-22,"he quiet homestead, still a-drowse. Gradually the aliens became part and parcel of Ruvia. Gradually Elena ",still|a|drowse|Gradually|the,became|part|and|parcel|of
nla.obj-562701660,1936-01-29,ns who emit howls for Commonwealth action against aliens exploiting our northern waters for valuable produ,howls|for|Commonwealth|action|against,exploiting|our|northern|waters|for
nla.obj-562701724,1936-02-19,except that he is in error in saying that untaxed aliens are operating outside the three-mile limit. The Q,error|in|saying|that|untaxed,are|operating|outside|the|three
nla.obj-562701724,1936-02-19,"ion, working within the boundary line as defined. Aliens simply help themselves and defy Australia to do a",the|boundary|line|as|defined,simply|help|themselves|and|defy
nla.obj-558326442,1936-05-06,"tic action to protect their pro- perty. Some day, aliens will get shot, and there will be added to our hea",their|pro|perty|Some|day,will|get|shot|and|there
nla.obj-558326726,1936-05-20,e forth- right Australian. They expelled unwanted aliens in defiance of Downing-street. They would have sc,right|Australian|They|expelled|unwanted,in|defiance|of|Downing|street
nla.obj-558327043,1936-06-10,movement which aims at the refusal of relief to ■ aliens and the deportation of those illegally in the cou,the|refusal|of|relief|to,and|the|deportation|of|those
nla.obj-631364223,1936-06-24,"ell was worth £40,000. It is highly probable that aliens, whose competition was to have been checked by th",It|is|highly|probable|that,whose|competition|was|to|have
nla.obj-608629421,1936-07-01,"burials, as well as the regulation of prisons and aliens. X X x * How to calculate the cubic content of a ",the|regulation|of|prisons|and,X|X|x|How|to
nla.obj-562239553,1936-07-29,s full of smoke and foreigners. There was so many aliens present that if we hadn’t known where we were we’,foreigners|There|was|so|many,present|that|if|we|hadn
nla.obj-562244203,1936-08-05,Greeks ex- ceeded “permanent” departures of these aliens by 633 and 214 respectively. With almost everythi,ceeded|permanent|departures|of|these,by|633|and|214|respectively
nla.obj-562287396,1936-09-16,"arl- and trochus-shell are increasingly ousted by aliens in sampans, who pay no taxes, buy nothing in Aust",shell|are|increasingly|ousted|by,in|sampans|who|pay|no
nla.obj-562287396,1936-09-16,"t of all, are tearing up the chicken shell. These aliens are stopped and their sampans are confiscated in ",up|the|chicken|shell|These,are|stopped|and|their|sampans
nla.obj-562295790,1936-09-23,"er for the nation’s health as well as its pocket. Aliens Grabbing Australian Fisheries. E. H. Angelo, M.L.",as|well|as|its|pocket,Grabbing|Australian|Fisheries|E|H
nla.obj-562407185,1936-11-04,"is discretion” — of blacks as well as whites, and aliens also, provided they “had declared their intention",as|well|as|whites|and,also|provided|they|had|declared
nla.obj-562418770,1936-11-18,"ion was to legislate for the exclusion of colored aliens, but, in deference to the wish of the Colonial Of",for|the|exclusion|of|colored,but|in|deference|to|the
nla.obj-617513584,1937-02-17," and designs, and trade marks: Naturalization and aliens: Foreign corporations, and trading or financial c",and|trade|marks|Naturalization|and,Foreign|corporations|and|trading|or
nla.obj-568033637,1937-05-19,"n its seat, grimly satisfied at having shown the “aliens” their places. $ * * * “Schnorrer”: A German stat",satisfied|at|having|shown|the,their|places|Schnorrer|A|German
nla.obj-567745717,1937-07-21,"st, with good harbor facilities. The law prevents aliens from taking up leases on their own account. The i",harbor|facilities|The|law|prevents,from|taking|up|leases|on
nla.obj-567745717,1937-07-21,"eir appreciation reserved one of the pews for the aliens. After a few appearances, however, the Chinese su",of|the|pews|for|the,After|a|few|appearances|however
nla.obj-568115170,1937-08-25,"i America, 2d. per copy. To all other places, 4d. ALIENS COME: BRITONS GO. There has been another outbreak",To|all|other|places|4d,COME|BRITONS|GO|There|has
nla.obj-568115170,1937-08-25,"ent pleaded that it was already upping and doing. Aliens, it said, are admitted only under permit which re",was|already|upping|and|doing,it|said|are|admitted|only
nla.obj-568115170,1937-08-25,"h immigration has ceased, and because most of the aliens travel in two or three foreign ships. Not only ha",and|because|most|of|the,travel|in|two|or|three
nla.obj-568115170,1937-08-25,British stock or rail at the advent of 300 or 400 aliens a month. The 300 or 400 aliens would be lost amon,advent|of|300|or|400,a|month|The|300|or
nla.obj-568115170,1937-08-25,vent of 300 or 400 aliens a month. The 300 or 400 aliens would be lost among the thousands of arriving Bri,month|The|300|or|400,would|be|lost|among|the
nla.obj-568115313,1937-10-13, to the Kalgoorlie riots over the em- ployment of aliens in mines. Trouble Trail: Max Brand (Hodder and St,over|the|em|ployment|of,in|mines|Trouble|Trail|Max
nla.obj-568185907,1937-11-03,favor- able consideration in the respect of white aliens who will engage in occupations in which there is ,in|the|respect|of|white,who|will|engage|in|occupations
nla.obj-572802682,1938-01-05,"e animals have increased beyond belief, hke other aliens, such as rabbits, spar- rows, gorse and blackberr",increased|beyond|belief|hke|other,such|as|rabbits|spar|rows
nla.obj-572802682,1938-01-05,"n border patrol and a bunch of crooks who smuggle aliens across the Mexican border. Charles Quigley, as a ",bunch|of|crooks|who|smuggle,across|the|Mexican|border|Charles
nla.obj-572802682,1938-01-05,"sh subjects travelling between Australia and M.L. Aliens must be in possession of a passport, obtainable f",between|Australia|and|M|L,must|be|in|possession|of
nla.obj-572802722,1938-01-19,"s proportion has increased by 32.76 p.c. However, aliens have never formed a very large proportion of Maor",32|76|p|c|However,have|never|formed|a|very
nla.obj-572802722,1938-01-19,"re were more in 1874 than there are to-day. Those aliens came mostly from northern Europe, and Maoriland, ",there|are|to|day|Those,came|mostly|from|northern|Europe
nla.obj-608677975,1938-05-05, are in Australia no huge groups of unassimilated aliens or unassimilable negroes. In the General Motors-H,no|huge|groups|of|unassimilated,or|unassimilable|negroes|In|the
nla.obj-572881854,1938-05-12,"later can? Consider, chaps, the hordes of envious aliens Whose eyes are on our empty spaces bent, With tho",chaps|the|hordes|of|envious,Whose|eyes|are|on|our
nla.obj-572881879,1938-05-19,given favorable consideration in respect of white aliens who are without guarantors in Australia provided ,consideration|in|respect|of|white,who|are|without|guarantors|in
nla.obj-572881936,1938-06-08,e possible to draft an agreement which would give aliens wishing to land legally fair and hospitable treat,an|agreement|which|would|give,wishing|to|land|legally|fair
nla.obj-572881936,1938-06-08,"le Sam drives. That gentleman has little time for aliens com- ing to his country to amass dollars and, per",gentleman|has|little|time|for,com|ing|to|his|country
nla.obj-572891465,1938-06-22,"f British citizenship so loosely. Never- theless, aliens flying the British flag are entitled to the prote",citizenship|so|loosely|Never|theless,flying|the|British|flag|are
nla.obj-572891501,1938-06-29,"t, under the National Incubus Bill, newly-arrived aliens —perhaps slushies in Greek fish- shops—will be be",National|Incubus|Bill|newly|arrived,perhaps|slushies|in|Greek|fish
nla.obj-572891574,1938-07-06,"; looked with superior- ity on these thousands of aliens bringing their strange tongues with them, their s",ity|on|these|thousands|of,bringing|their|strange|tongues|with
nla.obj-572891671,1938-07-13,r exemption while they retain their status. White aliens wanting permanent residence must obtain landing p,they|retain|their|status|White,wanting|permanent|residence|must|obtain
nla.obj-572891844,1938-07-27,"hips are merely nominally British, being owned by aliens and controlled, through the Spanish Campsa shippi",nominally|British|being|owned|by,and|controlled|through|the|Spanish
nla.obj-572891844,1938-07-27,"on to the population of the interior —of brooding aliens, ulcerated with hatred of the countries that had ",of|the|interior|of|brooding,ulcerated|with|hatred|of|the
nla.obj-572891866,1938-08-03,"mpire of the recent influx of medically qualified aliens, and to report thereon.” Dr. Ward said that they ",recent|influx|of|medically|qualified,and|to|report|thereon|Dr
nla.obj-572891866,1938-08-03,and apprehen- sion as to the results of admitting aliens. Dr. H. B. Morgan (London) spoke of the home- les,to|the|results|of|admitting,Dr|H|B|Morgan|London
nla.obj-572891866,1938-08-03,ars. They could not absorb an unlimited number of aliens with a foreign attitude towards the population. D,absorb|an|unlimited|number|of,with|a|foreign|attitude|towards
nla.obj-572891866,1938-08-03,g besieged with appli- cations for admission from aliens who have already fled European countries and from,appli|cations|for|admission|from,who|have|already|fled|European
nla.obj-572891866,1938-08-03,no further steps. Australia will admit only those aliens who are: (1) Dependent relatives of persons alrea,Australia|will|admit|only|those,who|are|1|Dependent|relatives
nla.obj-572891866,1938-08-03,"have £5O (Australian currency) landing money. (3) Aliens without Australian guarantors, similarly restrict",Australian|currency|landing|money|3,without|Australian|guarantors|similarly|restrict
nla.obj-572891866,1938-08-03, refugees follow that occupa- tion. The intake of aliens into England is increasing month by month. The of,occupa|tion|The|intake|of,into|England|is|increasing|month
nla.obj-572891992,1938-08-10,"r America, 2d. per copy. To all other places, 4d. ALIENS COME; BRITONS GO. For 11 months to May 31 arrival",To|all|other|places|4d,COME|BRITONS|GO|For|11
nla.obj-572891992,1938-08-10,ad no evidence that the landing money required of aliens was deposited for them by others and lifted when ,the|landing|money|required|of,was|deposited|for|them|by
nla.obj-572891992,1938-08-10,"tly on the violation of industrial stan- dards by aliens, employers and employees, in city and country. Th",of|industrial|stan|dards|by,employers|and|employees|in|city
nla.obj-572891992,1938-08-10,"for breaches of awards have been obtained against aliens,” and that fines amounted to a mere £6OO, but he ",awards|have|been|obtained|against,and|that|fines|amounted|to
nla.obj-572891992,1938-08-10,", and things like that. There are 4,000,000 enemy aliens in this republic ; and the women are as bad as th",are|4|000|000|enemy,in|this|republic|and|the
nla.obj-572891992,1938-08-10, we have got to guard our Presi- dent. Sixty-five aliens have been arrested for threatening his life. He i,our|Presi|dent|Sixty|five,have|been|arrested|for|threatening
nla.obj-572892039,1938-08-17,"fences or are to be picked up in the fields. With aliens’ fear of the law in a strange land, the exiles sn",up|in|the|fields|With,fear|of|the|law|in
nla.obj-572892039,1938-08-17," “Brigadier Girard”: If there’s anyone in Sydney, aliens included, who doesn’t know exactly the location o",there|s|anyone|in|Sydney,included|who|doesn|t|know
nla.obj-573028015,1938-08-31, sometimes noble and inspiring. But in these days aliens of inferior types increasingly write the songs an,inspiring|But|in|these|days,of|inferior|types|increasingly|write
nla.obj-573028015,1938-08-31,", whether returned men or not. — Jesmond (Vic.). “Aliens Come; Britons Go” Don’t agree with the assertion ",men|or|not|Jesmond|Vic,Come|Britons|Go|Don|t
nla.obj-573028031,1938-09-07,o bring in a bill to prevent the participation by aliens in assemblies for the purpose of propa- gating bl,to|prevent|the|participation|by,in|assemblies|for|the|purpose
nla.obj-608704353,1938-09-14,y figures were almost as bad as ever: arrivals of aliens exceeded departures by 775; departures of British,bad|as|ever|arrivals|of,exceeded|departures|by|775|departures
nla.obj-573091395,1938-11-16,nal law of nature to prevent their being rounded. Aliens in England. (Condensed from an article in London ,to|prevent|their|being|rounded,in|England|Condensed|from|an
nla.obj-573091395,1938-11-16,icle in London “Sunday Express.’’) There are more aliens living and working in Britain to-day than ever be,Sunday|Express|There|are|more,living|and|working|in|Britain
nla.obj-573091395,1938-11-16,"mple, it seems incredible, but it is a fact, that aliens who can hardly speak English are now driving Lond",it|is|a|fact|that,who|can|hardly|speak|English
nla.obj-573091395,1938-11-16,"f the streets. The textile industry attracts many aliens. Aus- trians, Germans and Poles have established ",The|textile|industry|attracts|many,Aus|trians|Germans|and|Poles
nla.obj-573091395,1938-11-16,"trolled by foreigners, mostly Russians and Poles. Aliens figure prominently also in the gown and millinery",foreigners|mostly|Russians|and|Poles,figure|prominently|also|in|the
nla.obj-573091395,1938-11-16,own shops are also being opened right and left by aliens. Often they start by employing British sales girl,opened|right|and|left|by,Often|they|start|by|employing
nla.obj-573091395,1938-11-16,to get over regulations—as relatives. Influential aliens do not hesitate to put pressure on British firms ,over|regulations|as|relatives|Influential,do|not|hesitate|to|put
nla.obj-573091395,1938-11-16,", competing on an equal basis against a number of aliens, was refused a supply of goods by the warehouse w",basis|against|a|number|of,was|refused|a|supply|of
nla.obj-573091395,1938-11-16,oyees. We had one case in London last week of two aliens who cannot speak English being given employment i,London|last|week|of|two,who|cannot|speak|English|being
nla.obj-573091395,1938-11-16,"m better posts. Shipping, of course, employs many aliens. It is estimated that at the moment, when British",Shipping|of|course|employs|many,It|is|estimated|that|at
nla.obj-573091395,1938-11-16,"fficult to secure berths, there are at least 7000 aliens in British ships. Some of the ships trading with ",there|are|at|least|7000,in|British|ships|Some|of
nla.obj-573091395,1938-11-16,Briton on board except the wireless operator. The aliens who are flocking into London are colonising defin,except|the|wireless|operator|The,who|are|flocking|into|London
nla.obj-573091418,1938-11-23," Guinea, and (2) won’t allow “mass immigration of aliens,” nor “tolerate any form of block settlement.” Th",t|allow|mass|immigration|of,nor|tolerate|any|form|of
nla.obj-573091439,1938-11-30,* * * What restrictions govern the immigration of aliens into N.S.W. ? —1657. The jV.iS.IK. Year-Book stat,restrictions|govern|the|immigration|of,into|N|S|W|1657
nla.obj-573091439,1938-11-30,7. The jV.iS.IK. Year-Book states: “At common law aliens have no legal right to admission to any British c,Book|states|At|common|law,have|no|legal|right|to
nla.obj-573091452,1938-12-07,"al patronage, and (2) for the registration of all aliens ; the Commonwealth electoral laws to apply, excep",for|the|registration|of|all,the|Commonwealth|electoral|laws|to
nla.obj-573091471,1938-12-14,"ment really wishes to be rid of them as dangerous aliens, as recent speeches of Dr. Goebbels seem to sugge",rid|of|them|as|dangerous,as|recent|speeches|of|Dr
nla.obj-573091494,1938-12-21,"n away, along with the promised regis- tration-of-aliens measure, “national” insurance, the mortgage bank ",the|promised|regis|tration|of,measure|national|insurance|the|mortgage
nla.obj-573091494,1938-12-21,ver exonerated. Lane was later arrested under the Aliens Act for having failed to register a change of add,was|later|arrested|under|the,Act|for|having|failed|to
nla.obj-573152948,1939-01-18,ncourage lots of others to attempt the same game. Aliens are not yet required to register. An Aliens’ Regi,to|attempt|the|same|game,are|not|yet|required|to
nla.obj-573152948,1939-01-18,"game. Aliens are not yet required to register. An Aliens’ Registration Bill was introduced last session, a",yet|required|to|register|An,Registration|Bill|was|introduced|last
nla.obj-573153114,1939-02-01," in the press after Munich was a campaign against aliens, more especially against political and Jewish emi",Munich|was|a|campaign|against,more|especially|against|political|and
nla.obj-573153151,1939-02-08,", in spite of there being already about 2,500,000 aliens living in the country. If the number of natural- ",already|about|2|500|000,living|in|the|country|If
nla.obj-573153151,1939-02-08,"ng in the country. If the number of natural- ised aliens of the first generation be added, the total does ",the|number|of|natural|ised,of|the|first|generation|be
nla.obj-573153151,1939-02-08,", or about 7 per cent, of the present population. Aliens are filling France’s empty cradles ; aliens are p",cent|of|the|present|population,are|filling|France|s|empty
nla.obj-573153151,1939-02-08,tion. Aliens are filling France’s empty cradles ; aliens are providing recruits to fill some of the gaps i,filling|France|s|empty|cradles,are|providing|recruits|to|fill
nla.obj-573153151,1939-02-08,its to fill some of the gaps in the French army ; aliens are taking up some of the land abandoned by Frenc,gaps|in|the|French|army,are|taking|up|some|of
nla.obj-573153302,1939-02-22,part of the policy of the Government to plan that aliens who are given permission to come to Aus- tralia s,the|Government|to|plan|that,who|are|given|permission|to
nla.obj-573153302,1939-02-22,t facilitating or permitting undue aggregation of aliens in any particular towns or centres. The last para,or|permitting|undue|aggregation|of,in|any|particular|towns|or
nla.obj-573153302,1939-02-22,"l standards, and to prevent “undue aggregation of aliens” in particular places. In the long run, it will b",to|prevent|undue|aggregation|of,in|particular|places|In|the
nla.obj-573153302,1939-02-22,"ar places. In the long run, it will be better for aliens, as well as Australians, if these pledges are kep",it|will|be|better|for,as|well|as|Australians|if
