id,date,kwic,before,after
nla.obj-658194098,1916-08-10,"gramme will be a Bill for the disfranchisement of aliens of enemy origin, which the indefatigable John has",Bill|for|the|disfranchisement|of,of|enemy|origin|which|the
nla.obj-658194098,1916-08-10,"proposed Federal Bill for the disfranchisement of aliens of enemy origin, made it clear that the Vic. Mini",Bill|for|the|disfranchisement|of,of|enemy|origin|made|it
nla.obj-657974610,1916-08-24,son why the children of aDy par- ticular brand of aliens should not be massed together for educational pur,aDy|par|ticular|brand|of,should|not|be|massed|together
nla.obj-658016771,1916-10-05,"tales have been told of masters of British ships, aliens by birth or descent, divulging precious Admiralty",of|masters|of|British|ships,by|birth|or|descent|divulging
nla.obj-658016771,1916-10-05,"ficates of their parents and, if the offspring of aliens, the naturalisation papers of pa and ma. But this",and|if|the|offspring|of,the|naturalisation|papers|of|pa
nla.obj-658016794,1916-10-12,"[S. H. Prior, 214 George Street, Sydney.] liun by aliens, the 1.W.W., which has leavened the Labor leagues",George|Street|Sydney|liun|by,the|1|W|W|which
nla.obj-658016811,1916-10-19,"in Russian eyes—far more despicable still to hire aliens to do so. -4 “Mizzen” : Is there any reason why, ",more|despicable|still|to|hire,to|do|so|4|Mizzen
nla.obj-658016811,1916-10-19,"ns and Austrians, born here or abroad, are “enemy aliens.” Many others are not. The truth about all these ",here|or|abroad|are|enemy,Many|others|are|not|The
nla.obj-658016833,1916-10-26,er been quite so much enthusiasm before. Among 80 aliens who were granted certifi- cates of naturalisation,much|enthusiasm|before|Among|80,who|were|granted|certifi|cates
nla.obj-658831300,1916-11-09,"s run their unclean shows with the aid of kindred aliens, and employ their poorer brethren as hawkers. In ",with|the|aid|of|kindred,and|employ|their|poorer|brethren
nla.obj-658831300,1916-11-09,"of course, the last and chief reason. Whereas all aliens prefer to buy from aliens, the average Australian",and|chief|reason|Whereas|all,prefer|to|buy|from|aliens
nla.obj-658831300,1916-11-09,"ief reason. Whereas all aliens prefer to buy from aliens, the average Australian is not loyal to his own r",aliens|prefer|to|buy|from,the|average|Australian|is|not
nla.obj-658831321,1916-11-16,"skippers. The trouble will be to find out who are aliens. Fifty per cent, of the coastal men are “Dutchmen",to|find|out|who|are,Fifty|per|cent|of|the
nla.obj-659361669,1917-02-08," in a land which treats its scientific workers as aliens. And so far as The Bulletin is aware, there is no",treats|its|scientific|workers|as,And|so|far|as|The
nla.obj-659361669,1917-02-08,Mrs. Crow. After a heated dis- cussion the little aliens are roughly and wrathfullv fired out to battle fo,heated|dis|cussion|the|little,are|roughly|and|wrathfullv|fired
nla.obj-659361688,1917-02-15,usive job in reasonable comfort. Eleven of the 52 aliens naturalised in the Commonwealth during January we,comfort|Eleven|of|the|52,naturalised|in|the|Commonwealth|during
nla.obj-659361688,1917-02-15, to let everybody know who and what are the enemy aliens now being re- ceived into the bosom of the Common,and|what|are|the|enemy,now|being|re|ceived|into
nla.obj-659361702,1917-02-22,in favor of an official classification of all the aliens and people of alien parentage in Australia can be,official|classification|of|all|the,and|people|of|alien|parentage
nla.obj-659411830,1917-03-15,"g as the makers don’t arrive in person. After the aliens’ break, a police launch fussed up and began guard",arrive|in|person|After|the,break|a|police|launch|fussed
nla.obj-659466999,1917-04-19,"ountry, like the worst animal and weed pests, are aliens—the sparrow and the Indian mina, introduced in 18",animal|and|weed|pests|are,the|sparrow|and|the|Indian
nla.obj-659466999,1917-04-19,"neck of the last sparrow in the country. If these aliens were eliminated, producers would have little to c",in|the|country|If|these,were|eliminated|producers|would|have
nla.obj-646717112,1917-05-10,ers is that they will not enlist whilst dangerous aliens hold billets where they have the chance to be mis,will|not|enlist|whilst|dangerous,hold|billets|where|they|have
nla.obj-646717157,1917-05-24,"ted in an interesting revelation concerning enemy aliens. A year ago, as now appears, Robert G ARRAN draft",an|interesting|revelation|concerning|enemy,A|year|ago|as|now
nla.obj-646717157,1917-05-24,"ary War Precautions Regulations inimical to enemy aliens in their business dealings, or industrial . pursu",Precautions|Regulations|inimical|to|enemy,in|their|business|dealings|or
nla.obj-659467081,1917-05-31,gling on with the few Chinamen left: but as these aliens are weak- ening with old age and no more are allo,Chinamen|left|but|as|these,are|weak|ening|with|old
nla.obj-659467081,1917-05-31,"ect that the worst bird pests in this country are aliens, I would like to ask what about the rozella, the ",pests|in|this|country|are,I|would|like|to|ask
nla.obj-646717199,1917-06-14,"tend with the presence of millions of foreigners, aliens by race, by faith, by language, y tradition. So l",presence|of|millions|of|foreigners,by|race|by|faith|by
nla.obj-646717199,1917-06-14,"body tries to make them Americans, so they remain aliens by the million. In some cities and districts ther",them|Americans|so|they|remain,by|the|million|In|some
nla.obj-681064000,1917-07-26,pite of Tongan courtesy we were made to feel like aliens. We left Vavau quite satisfied about that island’,were|made|to|feel|like,We|left|Vavau|quite|satisfied
nla.obj-681079074,1917-08-02,until 1899 that N. S. Wales woke to the fact that aliens had a free run as pilots in its home ports. The r,woke|to|the|fact|that,had|a|free|run|as
nla.obj-681079074,1917-08-02,"Parliament also altered its law on the sub- ject. Aliens, as pilots, were barred in future; but the certif",law|on|the|sub|ject,as|pilots|were|barred|in
nla.obj-681087839,1917-08-09,"n simi- larly affected. The townies have remained aliens, but the sensible ones who've gone outback have b",affected|The|townies|have|remained,but|the|sensible|ones|who
nla.obj-681092485,1917-08-16," Nellie Ferguson and Vivian Edwards play the evil aliens, and they would no doubt have got away with Allan",Vivian|Edwards|play|the|evil,and|they|would|no|doubt
nla.obj-681105516,1917-08-30,up that creek such bad immigrants and undesirable aliens as lantana and prickly-pear are eating the sane w,such|bad|immigrants|and|undesirable,as|lantana|and|prickly|pear
nla.obj-681120390,1917-09-06,"ght the Police Superinten- dent to get rid of the aliens from over the border as soon as he could, so that",to|get|rid|of|the,from|over|the|border|as
nla.obj-681148394,1917-09-27,"d Hun patriots, and that a lot more internment of aliens is necessary for the safety of seafarers here- ab",a|lot|more|internment|of,is|necessary|for|the|safety
nla.obj-681148394,1917-09-27,e.” “Fax”: After three years’ experience of enemy aliens the Musicians’ Union of Vic. has decided to have ,three|years|experience|of|enemy,the|Musicians|Union|of|Vic
nla.obj-681164198,1917-10-04,y ; and so that in Maoriland they call us “Austra-aliens” and job-snatching emigrants to countries that ha,Maoriland|they|call|us|Austra,and|job|snatching|emigrants|to
nla.obj-681176053,1917-10-18,"ed Ger- mans and its multitude of other “neutral” aliens, could remain immune from the ex- periences of ot",its|multitude|of|other|neutral,could|remain|immune|from|the
nla.obj-681178301,1917-10-25,ring this in mind The Bul- letin wonders how many aliens with “good Australian names” are now at naval wor,Bul|letin|wonders|how|many,with|good|Australian|names|are
nla.obj-681189477,1917-11-08,te alarm; large numbers of German and other enemy aliens were naturalised; labor strikes were permitted to,of|German|and|other|enemy,were|naturalised|labor|strikes|were
nla.obj-681189477,1917-11-08,"vailable; large numbers of German and other enemy aliens were allowed the freedom of the country, and were",of|German|and|other|enemy,were|allowed|the|freedom|of
nla.obj-681189477,1917-11-08, an alias! Our War Pre- cautions Act leaves enemy aliens so much at liberty that they can change their ide,Pre|cautions|Act|leaves|enemy,so|much|at|liberty|that
nla.obj-681189477,1917-11-08,"oading purposes, yet we won-; der why those enemy aliens think us fools! ; War is a queer business; but th",won|der|why|those|enemy,think|us|fools|War|is
nla.obj-681247007,1917-12-27,ng:— The requirement of the Commonwealth was that aliens should themselves engage in the service of the Co,of|the|Commonwealth|was|that,should|themselves|engage|in|the
nla.obj-681247007,1917-12-27,mere fact of war sup- ported an attempt to compel aliens to personally enter the King’s service outside th,ported|an|attempt|to|compel,to|personally|enter|the|King
nla.obj-659566524,1918-01-10,eutonic peoples—by their original skull formation aliens among the peoples of Europe—were almost accepted ,by|their|original|skull|formation,among|the|peoples|of|Europe
nla.obj-659602735,1918-03-07,"ything in the garden was lovely. Truly, the enemy aliens in Aus- tralia have good cause to treat us as sil",was|lovely|Truly|the|enemy,in|Aus|tralia|have|good
nla.obj-659602770,1918-03-14,"spirit of unrest was ap- parent among the musical aliens, and Hughes and Jenkins wondered what was in the ",ap|parent|among|the|musical,and|Hughes|and|Jenkins|wondered
nla.obj-659602797,1918-03-21,"rnment had no power to intern influ- ential enemy aliens moving in the best Mel- bourne sassiety, and the ",to|intern|influ|ential|enemy,moving|in|the|best|Mel
nla.obj-659635770,1918-04-18,nd rather perfunctory Justice' Real on two German aliens who cheerfully admitted that they had been settin,Justice|Real|on|two|German,who|cheerfully|admitted|that|they
nla.obj-659848771,1918-06-20," in these establishments were German and Austrian aliens, but they invariably included among- their genera",establishments|were|German|and|Austrian,but|they|invariably|included|among
nla.obj-659848771,1918-06-20,t bide in peace at home The while they knew that ‘aliens’ bled To save Australia’s cot and dome And hold i,The|while|they|knew|that,bled|To|save|Australia|s
nla.obj-659848985,1918-07-11,"a point of order re the non-internment of “damned aliens,” and the expres- sion “damned” as applied to ali",the|non|internment|of|damned,and|the|expres|sion|damned
nla.obj-659848985,1918-07-11,"ens,” and the expres- sion “damned” as applied to aliens was so shocking to the House that the Speaker ord",sion|damned|as|applied|to,was|so|shocking|to|the
nla.obj-659848985,1918-07-11,lly was his demand for more internment of “damned aliens” happened on Mon- day night of last week. Next da,for|more|internment|of|damned,happened|on|Mon|day|night
nla.obj-659848985,1918-07-11,ution urging the Gov- ernment to intern all enemy aliens and all naturalised subjects born in enemy countr,ernment|to|intern|all|enemy,and|all|naturalised|subjects|born
nla.obj-659848985,1918-07-11,e damned feelings of Billing re the internment of aliens on the Monday night were the feelings of the whol,Billing|re|the|internment|of,on|the|Monday|night|were
nla.obj-659849074,1918-07-25,it. : “0.K.”: The latest demand for internment of aliens in Britain is a mighty strong en- dorsement of ev,latest|demand|for|internment|of,in|Britain|is|a|mighty
nla.obj-659849074,1918-07-25,earce to modify his policy of toleration of enemy aliens .in view of the growing distrust of them in Great,policy|of|toleration|of|enemy,in|view|of|the|growing
nla.obj-659925519,1918-08-29, in the Botanic Gardens. The director finds these aliens responsible for the mysterious cutting off of you,Gardens|The|director|finds|these,responsible|for|the|mysterious|cutting
nla.obj-660014104,1918-09-12," people who are out in the cold include lunatics, aliens, people who lack a certain residential qualificat",in|the|cold|include|lunatics,people|who|lack|a|certain
nla.obj-660014148,1918-09-19,he Bolsheviks reckon that the murder of 159 enemy aliens is poor compensation for the assassination of one,the|murder|of|159|enemy,is|poor|compensation|for|the
nla.obj-660014148,1918-09-19,"d Bolshevik. Also, they have decided to count all aliens as enemy unless they are Huns. Considine, M.H.R.,",have|decided|to|count|all,as|enemy|unless|they|are
nla.obj-660014161,1918-09-26,"these people? Mostly Germans or other' unfriendly aliens, who should have been interned to keep them out o",Mostly|Germans|or|other|unfriendly,who|should|have|been|interned
nla.obj-663674873,1918-11-21," on record. From that on it improved. Some of the aliens became fair tradesmen, but the “white” work was g",it|improved|Some|of|the,became|fair|tradesmen|but|the
nla.obj-663554923,1918-12-05," Australian people, is due to the verbal froth of aliens with criminal countenances, who shout till they a",to|the|verbal|froth|of,with|criminal|countenances|who|shout
nla.obj-669400265,1919-01-02,"-born, 10 per cent. British, and only 4 per cent, aliens. We ought to try to preserve that ratio, so as to",and|only|4|per|cent,We|ought|to|try|to
nla.obj-669400560,1919-01-23,2) It had been his duty to intern over 4000 enemy aliens in order to protect Australia and pre- vent inter,to|intern|over|4000|enemy,in|order|to|protect|Australia
nla.obj-669400560,1919-01-23,gler has the audacity to cite 4000 interned enemy aliens plus their relatives and friends. Pearce the free,to|cite|4000|interned|enemy,plus|their|relatives|and|friends
nla.obj-669400560,1919-01-23,"e-and-independent personal interner of 4000 enemy aliens! Why, public opinion simply had to compel the gat",personal|interner|of|4000|enemy,Why|public|opinion|simply|had
nla.obj-669400560,1919-01-23,"Henry Horsecollar’s” cheap sneer at Ulstermen as “aliens.” It is quite natural that, as leaders of the Iri",cheap|sneer|at|Ulstermen|as,It|is|quite|natural|that
nla.obj-669400583,1919-01-30,he very meanest local white women would mate with aliens so low in the scale of civilisa- tion. The type o,white|women|would|mate|with,so|low|in|the|scale
nla.obj-669400620,1919-02-13,"the earth and filled their places with dirt-cheap aliens. We require neither squire nor Cobdenism, nor the",their|places|with|dirt|cheap,We|require|neither|squire|nor
nla.obj-669400685,1919-03-13,"land ? They were not his people, these poly- glot aliens! The door opened, a frightened face peered out, a",his|people|these|poly|glot,The|door|opened|a|frightened
nla.obj-669400685,1919-03-13," in willing sacrifice, giving of herself to these aliens, unthanked, hardly understood. He saw all this an",giving|of|herself|to|these,unthanked|hardly|understood|He|saw
nla.obj-669400721,1919-03-27,markable. All Irishmen would automatically become aliens. If they emigrated they would cease to have votes,All|Irishmen|would|automatically|become,If|they|emigrated|they|would
nla.obj-669400721,1919-03-27,"itions. If they returned to Ireland they would be aliens there — unless, indeed, it was held that through ",to|Ireland|they|would|be,there|unless|indeed|it|was
nla.obj-669400721,1919-03-27,establishment of the new republic they had become aliens in the foreign land wherein they had settled. The,new|republic|they|had|become,in|the|foreign|land|wherein
nla.obj-669400721,1919-03-27," the right to demand simi- lar consideration, and aliens may in time rule some of the States—possibly the ",demand|simi|lar|consideration|and,may|in|time|rule|some
nla.obj-669400745,1919-04-03,ustralia contains a num- ber of Germans and other aliens. They call themselves “Bolsheviks.” meaning that ,ber|of|Germans|and|other,They|call|themselves|Bolsheviks|meaning
nla.obj-674919835,1919-04-24,"y three times as large a propor- tion of European aliens in its population as the other States, which acco",a|propor|tion|of|European,in|its|population|as|the
nla.obj-674919856,1919-05-01, more or less banded together for mutual support. Aliens import aliens for trading purposes; hence the pre,banded|together|for|mutual|support,import|aliens|for|trading|purposes
nla.obj-674919856,1919-05-01,banded together for mutual support. Aliens import aliens for trading purposes; hence the pre- valence of b,for|mutual|support|Aliens|import,for|trading|purposes|hence|the
nla.obj-674919938,1919-05-29,"okers, and sold, wholesale and retail, by swarthy aliens, as a rule. The price of M.L. smoked cod in Mel- ",wholesale|and|retail|by|swarthy,as|a|rule|The|price
nla.obj-674920002,1919-06-19,"ded that all convicted traitors, many of whom are aliens, should be released from gaol, have their convict",traitors|many|of|whom|are,should|be|released|from|gaol
nla.obj-674920002,1919-06-19,"lia. which runs it closely in its pro- portion of aliens, is a good second. Queens- land, with about one-t",in|its|pro|portion|of,is|a|good|second|Queens
nla.obj-674920028,1919-06-26,r. The Commonwealth is teem- ing with undesirable aliens who are anxious not to leave it. At the recent me,is|teem|ing|with|undesirable,who|are|anxious|not|to
nla.obj-674920028,1919-06-26,gn- ing of the Peace treaty; and last April a new Aliens Bill was introduced to the House of Commons. The ,and|last|April|a|new,Bill|was|introduced|to|the
nla.obj-674920028,1919-06-26, his bcna fides or otherwise in this respect. The Aliens Board has just been constituted in N. S. Wales. I,otherwise|in|this|respect|The,Board|has|just|been|constituted
nla.obj-664181771,1919-07-10,whiting to the dizzy limit. If the importation of aliens is dis- couraged by the appointment of Australian,limit|If|the|importation|of,is|dis|couraged|by|the
nla.obj-664181811,1919-07-17,"it.ons, which are largely the work of disgruntled aliens, are hand.eappirig all industry. No earthly reaso",largely|the|work|of|disgruntled,are|hand|eappirig|all|industry
nla.obj-664181811,1919-07-17,dford is against the deportation of unnaturalised aliens (B. 3/7/T9). He says: “The war is finished and wh,against|the|deportation|of|unnaturalised,B|3|7|T9|He
nla.obj-664181948,1919-07-24,etin pointed out as far back as June 26 tliat the Aliens Board was the proper tribunal to handle the case ,as|June|26|tliat|the,Board|was|the|proper|tribunal
nla.obj-664182116,1919-08-07,me day at Victoria Park only four winners were by aliens. * * * * Remarkable how the fact of being beaten ,only|four|winners|were|by,Remarkable|how|the|fact|of
nla.obj-664232451,1919-08-14,"- point of the strikers. London was crammed with* aliens, many of them dangerous criminals. The handling o",strikers|London|was|crammed|with,many|of|them|dangerous|criminals
nla.obj-664232451,1919-08-14,"en Senator Barnes asked him about the inquiry"" re aliens in the Federal service. Millen had to admit that ",him|about|the|inquiry|re,in|the|Federal|service|Millen
nla.obj-664232472,1919-08-21, were cancelled on the condition that all colored aliens must be discharged and the land worked by white l,the|condition|that|all|colored,must|be|discharged|and|the
nla.obj-664232495,1919-08-28,"opose to come as cheap labor or as servants or as aliens, but as citizens —full-blown citizens, with a vot",or|as|servants|or|as,but|as|citizens|full|blown
nla.obj-664272375,1919-10-02,ase relating to the right of the State to exclude aliens. There will be a sixth portrait added soon—that o,of|the|State|to|exclude,There|will|be|a|sixth
nla.obj-664301337,1919-11-06,"em of “ennob- ling” the bloated Jews, brewers and aliens who subscribe large lump sums to political party ",the|bloated|Jews|brewers|and,who|subscribe|large|lump|sums
nla.obj-666460892,1919-12-04, repentance unless it repents by mas- sacring the aliens. Almost anything else even Freetrade —can be repe,repents|by|mas|sacring|the,Almost|anything|else|even|Freetrade
nla.obj-666460934,1919-12-18,"ralia is plundered, and thus falling into debt to aliens and being enslaved by chains of interest through ",thus|falling|into|debt|to,and|being|enslaved|by|chains
nla.obj-666460950,1920-01-01,"at w e are pay- ?l,lces every, year to strangers, aliens aifd niggers to make these things for us. Ihe nee",lces|every|year|to|strangers,aifd|niggers|to|make|these
nla.obj-626908338,1920-02-12,"be washed and combed abroad and thus pay wages to aliens, while restricting the supplies of local factorie",and|thus|pay|wages|to,while|restricting|the|supplies|of
nla.obj-626908338,1920-02-12,l the year round. An instance of the way in which aliens sometimes reach Australian territory came to ligh,of|the|way|in|which,sometimes|reach|Australian|territory|came
nla.obj-626908452,1920-04-22,m seem harmless. These people and other low-grade aliens of their sort are influential out of all proporti,people|and|other|low|grade,of|their|sort|are|influential
nla.obj-626908452,1920-04-22,"ernment camp, notwith- standing the fact that the Aliens, Board had recom- mended his immediate deportatio",standing|the|fact|that|the,Board|had|recom|mended|his
nla.obj-626908471,1920-04-29,l Irishmen in the British Empire as unnaturalised aliens and subjects of the Irish Republic. They would na,the|British|Empire|as|unnaturalised,and|subjects|of|the|Irish
nla.obj-626908494,1920-05-06,"♦ Keeping Track of the Alien. The Registration of Aliens Bill, which arouses so much fury among a class th",the|Alien|The|Registration|of,Bill|which|arouses|so|much
nla.obj-626908532,1920-05-20,"new gang, largely made up of blatant and ignorant aliens, who are allowed by Labor to declare war against ",up|of|blatant|and|ignorant,who|are|allowed|by|Labor
nla.obj-626908578,1920-06-10,the Government has abdi- cated the right to expel aliens at its pleasure when it regards them as undesirab,cated|the|right|to|expel,at|its|pleasure|when|it
nla.obj-665570534,1920-07-08,"ry adventures undertaken by Hun permission, these aliens dictated Eng- land’s foreign policy, had their ow",undertaken|by|Hun|permission|these,dictated|Eng|land|s|foreign
nla.obj-665570534,1920-07-08," elemen- tary precaution of keeping a register of aliens, because they were specially invited here. You sa",of|keeping|a|register|of,because|they|were|specially|invited
nla.obj-665570534,1920-07-08,"ted them? Nine times out of ten, at any rate, the aliens who were here already! And even suppose they were",ten|at|any|rate|the,who|were|here|already|And
nla.obj-665570534,1920-07-08,"e they were invited, the recent behavior of other aliens has been such that they can’t reasonably object t",the|recent|behavior|of|other,has|been|such|that|they
nla.obj-665754850,1920-08-12,"r. Send home to the republic a multitude of these aliens, in order to make room for the uncongenial people",republic|a|multitude|of|these,in|order|to|make|room
nla.obj-665754891,1920-08-26,"g, and they were leaving also. The right to expel aliens with- out explanation is so fully recognised, exc",also|The|right|to|expel,with|out|explanation|is|so
nla.obj-665754915,1920-09-02,920. DISFRANCHISED AUSTRALIA AND THE ENFRANCHISED ALIENS WHO RUN IT. The arrogant alien or unbidden guest ,DISFRANCHISED|AUSTRALIA|AND|THE|ENFRANCHISED,WHO|RUN|IT|The|arrogant
nla.obj-665809804,1920-09-09,"most entirely males, and including a multitude of aliens and immature persons, which Garden and others lik",and|including|a|multitude|of,and|immature|persons|which|Garden
nla.obj-665809820,1920-09-16,"kers, and many, if not most, of them strangers or aliens, should be allowed to organise some 80,000 railwa",most|of|them|strangers|or,should|be|allowed|to|organise
nla.obj-665809820,1920-09-16,"ke a dreadful mess of our finances, that they are aliens, subjects of a foreign repub- lic, and that here ",our|finances|that|they|are,subjects|of|a|foreign|repub
nla.obj-665809885,1920-10-07,"y men who believed in the cause of Australia. The aliens, anarchists, Bolsheviks and I.W.W.’s remained beh",the|cause|of|Australia|The,anarchists|Bolsheviks|and|I|W
nla.obj-665809885,1920-10-07,habit of prohibiting the ownership of freehold by aliens is fairly common all over the world. The Japanese,the|ownership|of|freehold|by,is|fairly|common|all|over
nla.obj-665809885,1920-10-07,their own fish-shops. Granted that the forbidding aliens pay more attention to the set-out of the goods th,shops|Granted|that|the|forbidding,pay|more|attention|to|the
nla.obj-665809905,1920-10-14," cut no figure in union matters; some of them are aliens or under age, and they would only amount, if all ",matters|some|of|them|are,or|under|age|and|they
nla.obj-666501951,1920-11-11,"nly intended as an interference with our affairs. Aliens shouldn’t be allowed to own, control or edit pape",an|interference|with|our|affairs,shouldn|t|be|allowed|to
nla.obj-666501951,1920-11-11,"slay the native born. London reeks with low-class aliens, and if revolution came the foreign-born would be",London|reeks|with|low|class,and|if|revolution|came|the
nla.obj-666501972,1920-11-18,"ists of Workers, Soldiers and Peasants’ deputies. Aliens and boys of IS have votes. Wholesale disqualifica",Workers|Soldiers|and|Peasants|deputies,and|boys|of|IS|have
nla.obj-666549830,1920-12-16,"epublic and the Irish thus automatically be- come aliens, the sooner Australia will be able to have a Parl",Irish|thus|automatically|be|come,the|sooner|Australia|will|be
nla.obj-666549830,1920-12-16, country’s mercantile marine be over-run by these aliens; and on the industrial side the shipowners have b,be|over|run|by|these,and|on|the|industrial|side
nla.obj-666550063,1920-12-30,"advocates. Its definition of liberty, largely for aliens, is the right of a largely alien mob to destroy A",definition|of|liberty|largely|for,is|the|right|of|a
nla.obj-660129012,1921-01-06,"lls outside the rail- way stations. These swarthy aliens are agents, seemingly, for the Dago shops. Their ",rail|way|stations|These|swarthy,are|agents|seemingly|for|the
